Input.eventId,Input.summaryId,Input.qIdList,Input.summary_text,Input.statement_1,Input.statement_2,Input.statement_3,Input.statement_4,Input.statement_5,Input.statement_6,Input.statement_7,Input.statement_8,Input.statement_9,Input.statement_10,Input.statement_11,Input.statement_12,Input.statement_13,Input.statement_14,Input.statement_15,Input.statement_16,Answer.S10Answer,Answer.S11Answer,Answer.S12Answer,Answer.S13Answer,Answer.S14Answer,Answer.S15Answer,Answer.S16Answer,Answer.S1Answer,Answer.S2Answer,Answer.S3Answer,Answer.S4Answer,Answer.S5Answer,Answer.S6Answer,Answer.S7Answer,Answer.S8Answer,Answer.S9Answer
cnndm5334,presumm_out_abs,"['1472', '1473', '1474', '1475', '1476', '1477', '1478', '1479', '1480', '1481', '1482', '1483', '1484', '1485', '1486', '1487']","Chloe Owens , 27 , from Swanley , Kent , came up with the idea for Bump 2 breast when she was pregnant with daughter Lola , now three months old . The app , which is available on all mobile platforms , has already been downloaded 20,000 times and is getting rave reviews .",Chloe Owens is 27.,Chloe Owens is from Swanley.,Chloe Owens designed a new app.,The new app is Bump 2 breast .,Chloe Owens came up with the idea when pregnant.,Chloe Owens was pregnant with daughter.,Chloe Owens' daughter is Lola.,Chloe Owens' daughter is now three months.,Chloe Owens says her and husband felt like 'Rabbits in headlights'.,Chloe Owens says her and husband felt a certain way at first.,Chloe Owens' husband is David.,Chloe Owens struggled to remember which boob to use.,Chloe Owens' reference to boobs was for breastfeeding.,BLANK,BLANK,BLANK,n,n,n,n,n,n,n,p,p,p,p,p,p,p,p,n
cnndm5334,presumm_out_abs,"['1472', '1473', '1474', '1475', '1476', '1477', '1478', '1479', '1480', '1481', '1482', '1483', '1484', '1485', '1486', '1487']","Chloe Owens , 27 , from Swanley , Kent , came up with the idea for Bump 2 breast when she was pregnant with daughter Lola , now three months old . The app , which is available on all mobile platforms , has already been downloaded 20,000 times and is getting rave reviews .",Chloe Owens is 27.,Chloe Owens is from Swanley.,Chloe Owens designed a new app.,The new app is Bump 2 breast .,Chloe Owens came up with the idea when pregnant.,Chloe Owens was pregnant with daughter.,Chloe Owens' daughter is Lola.,Chloe Owens' daughter is now three months.,Chloe Owens says her and husband felt like 'Rabbits in headlights'.,Chloe Owens says her and husband felt a certain way at first.,Chloe Owens' husband is David.,Chloe Owens struggled to remember which boob to use.,Chloe Owens' reference to boobs was for breastfeeding.,BLANK,BLANK,BLANK,n,n,n,n,n,n,n,p,p,p,p,p,p,p,p,n
cnndm5025,presumm_out_abs,"['1088', '1089', '1090', '1091', '1092', '1093', '1094', '1095', '1096', '1097', '1098', '1099', '1100', '1101', '1102', '1103']","Zbigniew Huminski , 38 , has confessed to strangling his nine - year - old victim . She was stripped naked and sexually assaulted after being forced into Huminski's car . He had been banned from French territory after being convicted twice for ` Extreme Violence ' . But he had driven to France in a Polish registered car this week , and intended to travel to Britain to stay with family who had emigrated there . DNA evidence corroborated by an autopsy showed ` strangulation and sexual violence ' .",Chloe's was playing with friend.,Zbigniew Huminski forced Chloe into the car.,Chloe's naked body was found.,Chloe's body was found in nearby woods.,Chloe's body was found an hour - and - A - half later.,Prosecutors say there is evidence.,The evidence was of ' strangulation and sexual violence '.,Zbigniew Huminski is a Polish immigrant.,Zbigniew Huminski was heading to England.,Zbigniew Huminski has admitted to killing.,BLANK,BLANK,BLANK,BLANK,BLANK,BLANK,p,n,n,n,n,n,n,n,p,p,n,n,n,p,n,n
cnndm5025,presumm_out_abs,"['1088', '1089', '1090', '1091', '1092', '1093', '1094', '1095', '1096', '1097', '1098', '1099', '1100', '1101', '1102', '1103']","Zbigniew Huminski , 38 , has confessed to strangling his nine - year - old victim . She was stripped naked and sexually assaulted after being forced into Huminski's car . He had been banned from French territory after being convicted twice for ` Extreme Violence ' . But he had driven to France in a Polish registered car this week , and intended to travel to Britain to stay with family who had emigrated there . DNA evidence corroborated by an autopsy showed ` strangulation and sexual violence ' .",Chloe's was playing with friend.,Zbigniew Huminski forced Chloe into the car.,Chloe's naked body was found.,Chloe's body was found in nearby woods.,Chloe's body was found an hour - and - A - half later.,Prosecutors say there is evidence.,The evidence was of ' strangulation and sexual violence '.,Zbigniew Huminski is a Polish immigrant.,Zbigniew Huminski was heading to England.,Zbigniew Huminski has admitted to killing.,BLANK,BLANK,BLANK,BLANK,BLANK,BLANK,n,n,n,n,n,n,n,n,n,n,n,n,n,n,n,n
cnndm9221,presumm_out_abs,"['256', '257', '258', '259', '260', '261', '262', '263', '264', '265', '266', '267', '268', '269', '270', '271']","The clip was filmed on Saturday in Shortandy Village , 40 miles north of the Capital Astana . It captures the cloud hovering in the sky for 15 minutes before vanishing without trace . The video has been viewed more than 50,000 times since being uploaded to YouTube .",A clip shows a mysterious black cloud.,The cloud was hanging over Shortandy.,The cloud was in the shape of a hoop.,The cloud did not move for more than 15 minutes.,The clip has been viewed many times.,The views on the clip are in the tens of thousands.,The clip has been viewed on YouTube.,The viewers suggest that the cloud was an alien spacecraft.,Experts think the cloud could have been caused by nearby factories.,BLANK,BLANK,BLANK,BLANK,BLANK,BLANK,BLANK,n,n,n,n,n,n,n,n,p,n,p,p,n,p,n,n
cnndm2292,presumm_out_abs,"['448', '449', '450', '451', '452', '453', '454', '455', '456', '457', '458', '459', '460', '461', '462', '463']","Tottenham will subsidise Emmanuel Adebayor's # 100,000 - per - week wages . The Togolese striker is out of favour under Mauricio Pochettino at White Hart Lane . The 31 - year - old has made just nine league starts this season . Click here for all the latest Tottenham News .",Emmanuel Adebayor has contract with Tottenham.,Emmanuel Adebayor's contract runs out in 2016.,Emmanuel Adebayor is a striker.,Emmanuel Adebayor / the striker wants more than his current salary.,Emmanuel Adebayor / the stirker earns 5.2 million.,Emmanuel Adebayor / the striker wants more than his current salary before accepting a move out of White Hart Lane.,Emmanuel Adebayor / the striker is from Togolese.,Emmanuel Adebayor / the striker has made nine league starts.,Emmanuel Adebayor / the striker has made nine league starts this season.,BLANK,BLANK,BLANK,BLANK,BLANK,BLANK,BLANK,n,n,n,n,n,n,n,p,n,p,n,n,n,n,p,p
cnndm6731,presumm_out_abs,"['1520', '1521', '1522', '1523', '1524', '1525', '1526', '1527', '1528', '1529', '1530', '1531', '1532', '1533', '1534', '1535']","Charles Terreni Jr was four times over the legal alcohol limit when he died , an autopsy has found . He was found at the Pi Kappa Alpha House in Columbia , South Carolina , around 10:30 am on March 18 , the morning after an alleged ` kegger ' at the House for the annual Irish holiday . On Wednesday , several stray cups and a keg were seen on the porch , as well as clover decorations .",Charles Terreni was 18.,Charles Terreni was found dead.,Charles Terreni was found at a frat house.,The frat house is in Columbia.,Charles Terreni was a USC freshman.,Charles Terreni was a member of the Pi Kappa Alpha House .,Coroner identified cause of death.,Toxicology tests showed the blood alcohol.,BLANK,The blood alcohol was .375 .,Neighbors said there was a large party.,A beer keg was still visible outside.,Cause of death identified was alcohol poisoning.,Charles Terreni was found on March 18.,BLANK,BLANK,n,n,p,n,p,n,n,n,p,p,p,n,p,n,p,n
cnndm10680,presumm_out_abs,"['832', '833', '834', '835', '836', '837', '838', '839', '840', '841', '842', '843', '844', '845', '846', '847']","Shiraz Nawaz , 36 , said he felt lucky to be alive after the 15 - foot flames shot out of the manhole in Shirley , Solihull . Father - of - two had been on his way to a local takeaway when he heard buzzing from the ground just a few feet behind him . Firefighters extinguished the blaze , which they said was caused by a fire in an underground link box - which distributes electricity .",Flames shot out the manhole .,Shiraz Nawaz felt lucky to be alive.,Fire erupted moments after Shiraz Nawaz walked over the manhole.,The manhole was in a busy street .,No - one was hurt in the incident.,Nawaz evacuated the area.,No-one was hurt after Nawaz evacuated the area .,Shiraz Nawaz walked over the manhole.,It is incredible that no - one was hurt.,BLANK,BLANK,BLANK,BLANK,BLANK,BLANK,BLANK,n,n,n,n,n,n,n,p,p,n,n,n,n,n,n,n
cnndm10680,presumm_out_abs,"['832', '833', '834', '835', '836', '837', '838', '839', '840', '841', '842', '843', '844', '845', '846', '847']","Shiraz Nawaz , 36 , said he felt lucky to be alive after the 15 - foot flames shot out of the manhole in Shirley , Solihull . Father - of - two had been on his way to a local takeaway when he heard buzzing from the ground just a few feet behind him . Firefighters extinguished the blaze , which they said was caused by a fire in an underground link box - which distributes electricity .",Flames shot out the manhole .,Shiraz Nawaz felt lucky to be alive.,Fire erupted moments after Shiraz Nawaz walked over the manhole.,The manhole was in a busy street .,No - one was hurt in the incident.,Nawaz evacuated the area.,No-one was hurt after Nawaz evacuated the area .,Shiraz Nawaz walked over the manhole.,It is incredible that no - one was hurt.,BLANK,BLANK,BLANK,BLANK,BLANK,BLANK,BLANK,n,n,n,n,n,n,n,p,p,n,n,n,n,n,n,n
cnndm1521,presumm_out_abs,"['320', '321', '322', '323', '324', '325', '326', '327', '328', '329', '330', '331', '332', '333', '334', '335']","Carrie Reichert , 43 , claims she was ` overdressed ' when she saw Harry playing strip billiards . She has now written a book about the night in the eye of the Royal Story . In an excerpt from her upcoming book , she says she couldn't help but notice how ` adorably cute his naked a ** was ' . Prince Harry was said to have invited 10 women to his VIP suite . Ms Reichert spent a month in Harrison County Jail in Mississippi after being arrested for cheque fraud .",Dominatrix claims she shared a kiss.,The kiss was hot.,The kiss was deep.,Dominatrix claimed she kissed Prince Harry.,Dominatrix claimed she kissed in Vegas.,Carrie Reichert was a dominatrix.,Carri Reichert / dominatrix said she felt overdressed.,Carri Reichert / dominatrix said she saw Prince Harry's a**.,Carri Reichert was 43 years old.,Carri Reichert / the 43 year old claimed in her book.,The book was upcoming.,Kensington Palace denied Carrie Reichart was invited.,Kensington Palace denied Carrie Reichart was invited to the hotel suite.,BLANK,BLANK,BLANK,p,p,n,n,n,n,n,n,n,n,n,n,n,p,p,p
cnndm9502,presumm_out_abs,"['1008', '1009', '1010', '1011', '1012', '1013', '1014', '1015', '1016', '1017', '1018', '1019', '1020', '1021', '1022', '1023']","Nasr Bitar spotted Google Street View on the streets of Mississauga , Canada . He followed in his own vehicle to get the All - important ` selfie ' . Image of his selfie has now been shared almost 2.9 million times .",Nasr Bitar spotted Google Street View car.,Nasr Bitar spotted Google Street View car driving around.,Nasr Bitar spotted Google Street View car last autumn.,Nasr Bitar decided it was ' his time to shine '.,Nasr Bitar followed in his car to get a selfie.,Nasr Bitar followed Google Street View car.,Nasr Bitar sensing the perfect moment in Mississauga.,Nasr Bitar got out and took the snap.,Picture of Nasr's selfie and the Street View Image was shared.,The image was shared 2.9 million times.,BLANK,BLANK,BLANK,BLANK,BLANK,BLANK,p,n,n,n,n,n,n,p,p,n,n,p,p,n,n,p
cnndm9502,presumm_out_abs,"['1008', '1009', '1010', '1011', '1012', '1013', '1014', '1015', '1016', '1017', '1018', '1019', '1020', '1021', '1022', '1023']","Nasr Bitar spotted Google Street View on the streets of Mississauga , Canada . He followed in his own vehicle to get the All - important ` selfie ' . Image of his selfie has now been shared almost 2.9 million times .",Nasr Bitar spotted Google Street View car.,Nasr Bitar spotted Google Street View car driving around.,Nasr Bitar spotted Google Street View car last autumn.,Nasr Bitar decided it was ' his time to shine '.,Nasr Bitar followed in his car to get a selfie.,Nasr Bitar followed Google Street View car.,Nasr Bitar sensing the perfect moment in Mississauga.,Nasr Bitar got out and took the snap.,Picture of Nasr's selfie and the Street View Image was shared.,The image was shared 2.9 million times.,BLANK,BLANK,BLANK,BLANK,BLANK,BLANK,p,n,n,n,n,n,n,p,p,n,n,p,p,p,n,p
cnndm10231,presumm_out_abs,"['544', '545', '546', '547', '548', '549', '550', '551', '552', '553', '554', '555', '556', '557', '558', '559']","The Red Wings ' Drew Miller says he's eager to hit the ice again just a day after receiving a cut that could have cost him his eyesight . The incident occurred shortly after a faceoff during the first period of Tuesday's game between the Red Wing and the Senators . While battling for the puck , Ottawa's Mark Stone lost his balance and lifted his skate backwards in an arc , catching Miller just under his visor .",Drew Miller plays for Detroit Red Wings.,Drew Miller was caught by a skate.,Drew Miller was caught in the first period.,Detroit Red Wings played against Ottawa Senators.,The cut required stitches to close.,The cut required 50-60 stitches to close.,The cut did not damage Miller's eye.,The Detroit Red Wings lost 2-1.,The Detroit Red wings remain in third place.,The Detroit Red Wings play in the Atlantic Division.,BLANK,BLANK,BLANK,BLANK,BLANK,BLANK,n,n,n,n,n,n,n,p,p,p,p,n,n,p,n,n
cnndm10231,presumm_out_abs,"['544', '545', '546', '547', '548', '549', '550', '551', '552', '553', '554', '555', '556', '557', '558', '559']","The Red Wings ' Drew Miller says he's eager to hit the ice again just a day after receiving a cut that could have cost him his eyesight . The incident occurred shortly after a faceoff during the first period of Tuesday's game between the Red Wing and the Senators . While battling for the puck , Ottawa's Mark Stone lost his balance and lifted his skate backwards in an arc , catching Miller just under his visor .",Drew Miller plays for Detroit Red Wings.,Drew Miller was caught by a skate.,Drew Miller was caught in the first period.,Detroit Red Wings played against Ottawa Senators.,The cut required stitches to close.,The cut required 50-60 stitches to close.,The cut did not damage Miller's eye.,The Detroit Red Wings lost 2-1.,The Detroit Red wings remain in third place.,The Detroit Red Wings play in the Atlantic Division.,BLANK,BLANK,BLANK,BLANK,BLANK,BLANK,n,n,n,n,n,n,n,p,p,p,p,n,n,p,n,n
cnndm9781,presumm_out_abs,"['368', '369', '370', '371', '372', '373', '374', '375', '376', '377', '378', '379', '380', '381', '382', '383']",Queens Park Rangers defeated West Brom 3 - 0 in their Premier League clash at The Hawthorns . Bobby Zamora opened the scoring for QPR with an astounding lob from a narrow angle . Charlie Austin headed QPR's second goal of the game for QPR on the 35th minute .,Eduardo Vargas put QPR ahead.,Eduardo Vargas had a spectacular strike.,The strike was from 25 yards.,The strike was after 15 minutes.,Charlie Austin doubled the lead.,Charlie Austin scored with a header.,Charlie Austin scored 20 minutes later.,Bobby Zamora made it three.,Victor Anichebe pulled one back for West Brom.,Youssouf Mulumbu was sent off.,Joey Barton scored.,BLANK,BLANK,BLANK,BLANK,BLANK,n,n,n,n,n,n,n,n,n,n,n,p,p,n,n,n
cnndm9781,presumm_out_abs,"['368', '369', '370', '371', '372', '373', '374', '375', '376', '377', '378', '379', '380', '381', '382', '383']",Queens Park Rangers defeated West Brom 3 - 0 in their Premier League clash at The Hawthorns . Bobby Zamora opened the scoring for QPR with an astounding lob from a narrow angle . Charlie Austin headed QPR's second goal of the game for QPR on the 35th minute .,Eduardo Vargas put QPR ahead.,Eduardo Vargas had a spectacular strike.,The strike was from 25 yards.,The strike was after 15 minutes.,Charlie Austin doubled the lead.,Charlie Austin scored with a header.,Charlie Austin scored 20 minutes later.,Bobby Zamora made it three.,Victor Anichebe pulled one back for West Brom.,Youssouf Mulumbu was sent off.,Joey Barton scored.,BLANK,BLANK,BLANK,BLANK,BLANK,n,n,n,n,n,n,n,n,n,n,n,p,p,n,n,n
cnndm5912,presumm_out_abs,"['464', '465', '466', '467', '468', '469', '470', '471', '472', '473', '474', '475', '476', '477', '478', '479']",Police say they have no objections to the 4 pm kick - off for Sunday's Manchester Derby at Old Trafford . The kick - off was agreed by all parties and revealed that the decision is down to good behaviour from supporters of each side . The Last Time United and City met in a late kick - off for a weekend match was in the FA Cup semi-final at Wembley in 2011 inside the ground fans in and close to the away end will be limited to two drinks every time they visit the bar .,Manchester United take on Manchester City.,The match is going to take place on Sunday.,The match will begin at 4 pm.,The match will take place at Old Trafford Home.,Police have no objections to the kick-off being late in the afternoon.,34 fans were arrested at Wembley.,The fans were arrested in 2011.,The fans were arrested in FA Cup semi-final.,The fans were arrested in the last late afternoon weekend kick-off.,The fans were arrested in the last late afternoon weekend kick-off in the Manchester Derby.,BLANK,BLANK,BLANK,BLANK,BLANK,BLANK,n,n,n,n,n,n,n,p,p,p,p,p,n,n,n,n
cnndm4637,presumm_out_abs,"['1552', '1553', '1554', '1555', '1556', '1557', '1558', '1559', '1560', '1561', '1562', '1563', '1564', '1565', '1566', '1567']","East of England Ambulance Service sent two ambulances to Epping Forest . Caller told crews ` someone ' had been run down , only for ` victim ' to turn out to be a squirrel . Another man said he had dropped his burger and it was ` bleeding ' . Another came from Basildon , Essex , who said ` I 've eaten too much takeaway food ' .",East of England Ambulance Service warned about hoax calls,The Ambulance Service warned that hoax calls can cost lives,Woman reported someone had been run over,Actual victim in the incident reported by the woman was a squirrel,A man dialled 999.,The man reported that he dropped a burger,The man reported that the dropped burger was bleeding,BLANK,BLANK,BLANK,BLANK,BLANK,BLANK,BLANK,BLANK,BLANK,n,n,n,n,n,n,n,n,n,n,n,n,p,p,n,n
cnndm6094,presumm_out_abs,"['1360', '1361', '1362', '1363', '1364', '1365', '1366', '1367', '1368', '1369', '1370', '1371', '1372', '1373', '1374', '1375']",Steven Finn was overlooked for the West Indies Tour . The 26 - year - old has spent time working on his run - up since the World Cup . Finn says he's been watching footage of when he was on the top of his form . England's fast - bowling stocks are starting to worry selectors .,Steven Finn plays for England,Steven Finn was left out of the England squad,England tour West Indies,Steven Finn is a Middlesex Quick Bowler,Steven Finn has regained form,Steven Finn's form returned after 12 months,Steven Finn said he's back to bowling,Steven Finn said he's bowling like he was a carefree 21 year old,Steven Finn has 23 test caps for England,Steven Finn played for England last in 2013,BLANK,BLANK,BLANK,BLANK,BLANK,BLANK,n,n,n,n,n,n,n,p,n,n,n,n,n,n,n,n
cnndm6094,presumm_out_abs,"['1360', '1361', '1362', '1363', '1364', '1365', '1366', '1367', '1368', '1369', '1370', '1371', '1372', '1373', '1374', '1375']",Steven Finn was overlooked for the West Indies Tour . The 26 - year - old has spent time working on his run - up since the World Cup . Finn says he's been watching footage of when he was on the top of his form . England's fast - bowling stocks are starting to worry selectors .,Steven Finn plays for England,Steven Finn was left out of the England squad,England tour West Indies,Steven Finn is a Middlesex Quick Bowler,Steven Finn has regained form,Steven Finn's form returned after 12 months,Steven Finn said he's back to bowling,Steven Finn said he's bowling like he was a carefree 21 year old,Steven Finn has 23 test caps for England,Steven Finn played for England last in 2013,BLANK,BLANK,BLANK,BLANK,BLANK,BLANK,n,n,n,n,n,n,n,n,n,n,n,n,n,n,n,n
cnndm9555,presumm_out_abs,"['1280', '1281', '1282', '1283', '1284', '1285', '1286', '1287', '1288', '1289', '1290', '1291', '1292', '1293', '1294', '1295']","Manchester City's tenacious , creative and versatile midfielder James Milner could leave as a free agent . Swansea's Gerhard Tremmel , 36 , is the understudy for Lukasz Fabianski but has done well in the cups . England's first - choice right - back at the World Cup is still a regular for Liverpool , but he looks almost certain to end his six - year spell at Anfield this summer .",Gerhard Tremmel plays for Swansea,Gerhard Tremmel was in goal,Gerhard Tremmel played for free agents' 4 -4-2,Glen Johnson was at the back,Kolo Toure was at the back,Ron Vlaar was at the back,Luke Garbutt was at the back,James Milner was in midfield,Mikel Arteta was in the midfield,Tom Cleverly was in the midfield,Jonas Gutierrez was in the midfield,Danny Ings plays for Burnley,Danny Ings was up front,James Wilson plays for Manchester United,James Wilson was up front,BLANK,n,n,n,n,n,n,n,p,n,n,n,n,n,n,p,n
cnndm9555,presumm_out_abs,"['1280', '1281', '1282', '1283', '1284', '1285', '1286', '1287', '1288', '1289', '1290', '1291', '1292', '1293', '1294', '1295']","Manchester City's tenacious , creative and versatile midfielder James Milner could leave as a free agent . Swansea's Gerhard Tremmel , 36 , is the understudy for Lukasz Fabianski but has done well in the cups . England's first - choice right - back at the World Cup is still a regular for Liverpool , but he looks almost certain to end his six - year spell at Anfield this summer .",Gerhard Tremmel plays for Swansea,Gerhard Tremmel was in goal,Gerhard Tremmel played for free agents' 4 -4-2,Glen Johnson was at the back,Kolo Toure was at the back,Ron Vlaar was at the back,Luke Garbutt was at the back,James Milner was in midfield,Mikel Arteta was in the midfield,Tom Cleverly was in the midfield,Jonas Gutierrez was in the midfield,Danny Ings plays for Burnley,Danny Ings was up front,James Wilson plays for Manchester United,James Wilson was up front,BLANK,n,n,n,n,n,n,n,p,n,n,n,n,n,n,n,n
cnndm8334,presumm_out_abs,"['224', '225', '226', '227', '228', '229', '230', '231', '232', '233', '234', '235', '236', '237', '238', '239']","Didier Drogba set up the ` Didier Drogba Foundation in Africa ' . The Chelsea forward hopes to inspire the next generation of footballers in Africa to fall in love with the game . The 37 - year - old scored the equaliser for Chelsea against Leicester on Wednesday . He said : ' I come from a poor family where I played football in the streets with my friends with no shoes , there was no grass but we still enjoyed it ' .",Didier Drogba given an award.,Didier Drogba given Barclays Spirit of the Game Award.,Didier Drogba was a 37 year old.,Didier Drogba's foundation has done impressive work.,Didier Drogba's foundation has done work in Africa.,Some of Chelsea's stars attended a charity ball.,"The charity ball raised 400,000.",Click here for all the latest Chelsea News .,BLANK,BLANK,BLANK,BLANK,BLANK,BLANK,BLANK,BLANK,n,n,n,n,n,n,n,n,n,p,n,p,n,n,n,n
cnndm10824,presumm_out_abs,"['80', '81', '82', '83', '84', '85', '86', '87', '88', '89', '90', '91', '92', '93', '94', '95']","Police say Michael Scott Shemansky came to their attention after he failed to appear for a supervised visit with his son on the same day Sandra Shemansky , 57 , was found dead at the home they shared in Winter Garden . An initial investigation determined there was foul play . He is already on parole for battery on law enforcement , has a history of bipolar mental illness , and was involuntarily committed to a psychiatric ward for an attempted suicide .",Police say Michael Scott Shemansky came to their attention.,Police say Michael Scott Shemansky came to their attention after he failed to appear for a supervised visit.,Michael Scott Shemansky was supposed to visit his son.,Michael Scott Shemansky was supposed to visit his son on Saturday.,Sandra Shemansky / mother / wife of Michael Shemansky was found dead.,Sandra Shemansky / mother / wife of Michael Shemansky was 57 years old.,Sandra Shemansky / mother / wife of Michael Shemansky was found dead on Saturday / same day.,Sandra Shemansky / mother / wife of Michael Shemansky was found dead at their home.,Sandra Shemansky / mother / wife of Michael Shemansky was found dead in Winter Garden.,Sandra Shemansky / mother / wife of Michael Shemansky was found dead in Florida.,Michael Shemansky was going through a difficult divorce.,Neighbors believe the stress of the divorce may have caused Michael to snap.,BLANK,BLANK,BLANK,BLANK,n,n,n,n,n,n,n,p,p,p,n,p,p,n,p,p
