Input.eventId,Input.summaryId,Input.qIdList,Input.summary_text,Input.statement_1,Input.statement_2,Input.statement_3,Input.statement_4,Input.statement_5,Input.statement_6,Input.statement_7,Input.statement_8,Input.statement_9,Input.statement_10,Input.statement_11,Input.statement_12,Input.statement_13,Input.statement_14,Input.statement_15,Input.statement_16,Answer.S10Answer,Answer.S11Answer,Answer.S12Answer,Answer.S13Answer,Answer.S14Answer,Answer.S15Answer,Answer.S16Answer,Answer.S1Answer,Answer.S2Answer,Answer.S3Answer,Answer.S4Answer,Answer.S5Answer,Answer.S6Answer,Answer.S7Answer,Answer.S8Answer,Answer.S9Answer
cnndm5231,presumm_out_abs,"['480', '481', '482', '483', '484', '485', '486', '487', '488', '489', '490', '491', '492', '493', '494', '495']","Border Collie Ace and Holly stood up on their hind legs , with their front paws up . Owner and trainer Dai Aoki runs the Waterloo , Australia - based dog care company positive dog care . PUP tales pointed out that the TV show ` The Living Room ' deemed Ace Australia's smartest dog in 2014 .",Ace is a Border Collie.,Holly is a Border Collie.,The Border Collies (or Ace and Holly) were caught on camera.,The Border Collies performed a gravity defying feat.,The Border Collies were pooches.,The Border Collies / pooches stood on their hind legs.,The Border Collies stood on their owner/their trainer/Dai Aoki.,Dai Aoki is the trainer of the Border Collies/pooches.,Dai Aoki is the owner of the Border Collies/pooches.,The Border Collies have appeared in a number of videos.,The videos show the Border Collies showing off their tricks.,BLANK,BLANK,BLANK,BLANK,BLANK,n,n,n,n,n,n,n,p,p,n,n,n,p,n,p,p
cnndm5231,presumm_out_abs,"['480', '481', '482', '483', '484', '485', '486', '487', '488', '489', '490', '491', '492', '493', '494', '495']","Border Collie Ace and Holly stood up on their hind legs , with their front paws up . Owner and trainer Dai Aoki runs the Waterloo , Australia - based dog care company positive dog care . PUP tales pointed out that the TV show ` The Living Room ' deemed Ace Australia's smartest dog in 2014 .",Ace is a Border Collie.,Holly is a Border Collie.,The Border Collies (or Ace and Holly) were caught on camera.,The Border Collies performed a gravity defying feat.,The Border Collies were pooches.,The Border Collies / pooches stood on their hind legs.,The Border Collies stood on their owner/their trainer/Dai Aoki.,Dai Aoki is the trainer of the Border Collies/pooches.,Dai Aoki is the owner of the Border Collies/pooches.,The Border Collies have appeared in a number of videos.,The videos show the Border Collies showing off their tricks.,BLANK,BLANK,BLANK,BLANK,BLANK,n,n,n,n,n,n,n,p,p,n,p,p,p,n,p,p
cnndm9325,presumm_out_abs,"['992', '993', '994', '995', '996', '997', '998', '999', '1000', '1001', '1002', '1003', '1004', '1005', '1006', '1007']","Theodora Hawksley , 29 , was until recently a post-doctoral researcher in theology at the University of Edinburgh . At the beginning of the year she decided to become a nun . She joined the Congregation of Jesus in January and is now living in their house in Willesden , North London .",There are figures/numbers from the Catholic Church.,Figures/Numbers show more and more becoming nuns.,A number of women are taking holy vows.,The number of women taking holy vows stood at just seven sometime in the past.,The number of women taking holy vows was seven in 2004.,The number of women taking holy vows had risen to 15.,The number of women taking holy vows had had risen to 15 in 2009.,The number of women taking holy vows had risen to 45.,The number of women taking holy vows had had risen to 45 in the last year.,One father made a statement.,The statement was about the reason people are being led towards religion.,The statement cites ' gap in the market for meaning ' as reason for people being led towards religion,BLANK,BLANK,BLANK,BLANK,n,n,n,n,n,n,n,n,n,n,n,n,n,n,n,n
cnndm9325,presumm_out_abs,"['992', '993', '994', '995', '996', '997', '998', '999', '1000', '1001', '1002', '1003', '1004', '1005', '1006', '1007']","Theodora Hawksley , 29 , was until recently a post-doctoral researcher in theology at the University of Edinburgh . At the beginning of the year she decided to become a nun . She joined the Congregation of Jesus in January and is now living in their house in Willesden , North London .",There are figures/numbers from the Catholic Church.,Figures/Numbers show more and more becoming nuns.,A number of women are taking holy vows.,The number of women taking holy vows stood at just seven sometime in the past.,The number of women taking holy vows was seven in 2004.,The number of women taking holy vows had risen to 15.,The number of women taking holy vows had had risen to 15 in 2009.,The number of women taking holy vows had risen to 45.,The number of women taking holy vows had had risen to 45 in the last year.,One father made a statement.,The statement was about the reason people are being led towards religion.,The statement cites ' gap in the market for meaning ' as reason for people being led towards religion,BLANK,BLANK,BLANK,BLANK,n,n,n,n,n,n,n,n,n,n,n,n,n,n,n,n
cnndm8054,presumm_out_abs,"['64', '65', '66', '67', '68', '69', '70', '71', '72', '73', '74', '75', '76', '77', '78', '79']","Just 28 of 700,000 babies born in the UK in 2013 were given the name . That compares to 235 Garys being born in 1996 , when the name was the 147th most popular in Britain .",Gary was a British name.,Gary was the 147th most popular British name in 1996.,Gary was the 1001st most popular British name in 2013.,Gary reached height of its popularity in 1964.,Gary was the 16th most popular British name in 1964 (or at the height of its popularity).,Dexter is one of the top 100 most popular British names.,Jenson is now one of the top 100 most popular British names.,BLANK,BLANK,BLANK,BLANK,BLANK,BLANK,BLANK,BLANK,BLANK,n,n,n,n,n,n,n,p,p,n,n,n,n,n,n,n
cnndm8054,presumm_out_abs,"['64', '65', '66', '67', '68', '69', '70', '71', '72', '73', '74', '75', '76', '77', '78', '79']","Just 28 of 700,000 babies born in the UK in 2013 were given the name . That compares to 235 Garys being born in 1996 , when the name was the 147th most popular in Britain .",Gary was a British name.,Gary was the 147th most popular British name in 1996.,Gary was the 1001st most popular British name in 2013.,Gary reached height of its popularity in 1964.,Gary was the 16th most popular British name in 1964 (or at the height of its popularity).,Dexter is one of the top 100 most popular British names.,Jenson is now one of the top 100 most popular British names.,BLANK,BLANK,BLANK,BLANK,BLANK,BLANK,BLANK,BLANK,BLANK,n,n,n,n,n,n,n,n,p,n,n,n,n,n,n,n
cnndm9825,presumm_out_abs,"['192', '193', '194', '195', '196', '197', '198', '199', '200', '201', '202', '203', '204', '205', '206', '207']","Twitter suspended more than 10,000 accounts linked to Isis last week . Most of them claim to be linked to extremists currently terrorising vast swathes of the Middle East . Twitter says Cull was prompted because they were being used by Tech - savvy jihadis to issue threats of violence .",Accounts vanished from Twitter/the social network.,Thousands of accounts vanished.,Thousands of accounts vanished last week.,Twitter said it received numerous reports.,The reports were about terror promoting users.,"Twitter decided to suspend 10,000 accounts.",Twitter suspended accounts for making threats of violence.,Suspensions were linked to a campaign by Collective Anonymous / 'hacktavist',Collective Anonymous are a 'hacktavist',The campaign / Collective Anonymous / 'hacktavist' targeted online jihadis.,BLANK,BLANK,BLANK,BLANK,BLANK,BLANK,n,n,n,n,n,n,n,p,p,p,n,p,p,p,n,n
cnndm9825,presumm_out_abs,"['192', '193', '194', '195', '196', '197', '198', '199', '200', '201', '202', '203', '204', '205', '206', '207']","Twitter suspended more than 10,000 accounts linked to Isis last week . Most of them claim to be linked to extremists currently terrorising vast swathes of the Middle East . Twitter says Cull was prompted because they were being used by Tech - savvy jihadis to issue threats of violence .",Accounts vanished from Twitter/the social network.,Thousands of accounts vanished.,Thousands of accounts vanished last week.,Twitter said it received numerous reports.,The reports were about terror promoting users.,"Twitter decided to suspend 10,000 accounts.",Twitter suspended accounts for making threats of violence.,Suspensions were linked to a campaign by Collective Anonymous / 'hacktavist',Collective Anonymous are a 'hacktavist',The campaign / Collective Anonymous / 'hacktavist' targeted online jihadis.,BLANK,BLANK,BLANK,BLANK,BLANK,BLANK,n,n,n,n,n,n,n,p,n,n,n,n,p,p,n,n
cnndm1017,presumm_out_abs,"['144', '145', '146', '147', '148', '149', '150', '151', '152', '153', '154', '155', '156', '157', '158', '159']",Anuradha Koirala has a rehab center in Kathmandu that is home to 425 young women and girls . She has offered to take in 200 other girls orphaned by the disaster . Koirala's group is relying on bottled water and is now rationing food .,Anuradha Koirala has been sleeping outdoors.,425/many young women and girls have been sleeping outdoors.,Many people have been sleeping outdoors because of aftershocks.,Pushpa Basnet was forced to evacuate her residence.,Pushpa Basnet cares for 45 children.,The children were forced to evacuate their residence.,Anuradha Koirala was a CNN Hero.,Pushpa Basnet was a CNN Hero.,Seven other CNN Heros were now assisting relief efforts.,The organizations of CNN Heros were now assisting relief efforts.,BLANK,BLANK,BLANK,BLANK,BLANK,BLANK,n,n,n,n,n,n,n,n,n,n,n,n,p,n,n,n
cnndm4315,presumm_out_abs,"['1184', '1185', '1186', '1187', '1188', '1189', '1190', '1191', '1192', '1193', '1194', '1195', '1196', '1197', '1198', '1199']","Sports brand features on Leaflet in terror group's de facto capital Raqqa . Warning Isis Jihadis about items of clothing they are no longer allowed to wear . Comes after one militant decried the popularity of Nike among ISIS fighters . He compared brand's name and Famous ` tick ' logo to wearing a Christian cross ban comes despite the fact one of the group's most famous commanders , Abu Waheeb , is well known for wearing Western sportswear .",Jihadis face fines fines for wearing Nike products.,Jihadis face whipping for wearing Nike products.,Jihadis face jail time for wearing Nike products.,Jihadis have banned Nike products.,Ban is due to the brand name.,The Nike brand name is shared with a Greek goddess.,Ban is also due to how the brand name sounds in Arabic.,The brand name sounds like sexual slang words in Arabic.,People under ISIS are already banned from wearing jeans.,ISIS also banned items of clothing carrying provocative language or swear words.,BLANK,BLANK,BLANK,BLANK,BLANK,BLANK,n,n,n,n,n,n,n,n,n,n,p,p,n,n,n,n
cnndm4315,presumm_out_abs,"['1184', '1185', '1186', '1187', '1188', '1189', '1190', '1191', '1192', '1193', '1194', '1195', '1196', '1197', '1198', '1199']","Sports brand features on Leaflet in terror group's de facto capital Raqqa . Warning Isis Jihadis about items of clothing they are no longer allowed to wear . Comes after one militant decried the popularity of Nike among ISIS fighters . He compared brand's name and Famous ` tick ' logo to wearing a Christian cross ban comes despite the fact one of the group's most famous commanders , Abu Waheeb , is well known for wearing Western sportswear .",Jihadis face fines fines for wearing Nike products.,Jihadis face whipping for wearing Nike products.,Jihadis face jail time for wearing Nike products.,Jihadis have banned Nike products.,Ban is due to the brand name.,The Nike brand name is shared with a Greek goddess.,Ban is also due to how the brand name sounds in Arabic.,The brand name sounds like sexual slang words in Arabic.,People under ISIS are already banned from wearing jeans.,ISIS also banned items of clothing carrying provocative language or swear words.,BLANK,BLANK,BLANK,BLANK,BLANK,BLANK,n,n,n,n,n,n,n,n,n,n,p,p,n,n,n,n
cnndm9086,presumm_out_abs,"['624', '625', '626', '627', '628', '629', '630', '631', '632', '633', '634', '635', '636', '637', '638', '639']",Liverpool face Aston Villa in the FA Cup semi-final at Wembley on Sunday . Brendan Rodgers says that a move to Manchester City would not be step up for Raheem Sterling . City have been heavily linked with a # 50million move for Sterling . Click here for all the latest Liverpool News .,Manchester City have been linked with Raheem Sterling.,Manchester City have been linked with summer move for Raheem Sterling.,Raheem Sterling has two years left on his contract.,Raheem Sterling is stalling on a new deal.,Brendan Rodgers says a move to city would not be a step up for Sterling.,Brendan Rodgers indicated it will take Manchester City 20 years to eclipse Liverpool.,BLANK,BLANK,BLANK,BLANK,BLANK,BLANK,BLANK,BLANK,BLANK,BLANK,n,n,n,n,n,n,n,p,n,n,n,p,n,n,n,n
cnndm1890,presumm_out_abs,"['432', '433', '434', '435', '436', '437', '438', '439', '440', '441', '442', '443', '444', '445', '446', '447']","Man spotted urinating in field of vegetables in Benington , Lincolnshire . Member of the public took the picture and informed th Clements & Son . Tesco has said its vegetables undergo ` extensive assessment and review process ' .",The worker was caught on camera.,The worker was caught by a member of the public.,Field owner was Clements and son.,Field owner was alerted.,The worker was a man.,The worker was sacked.,The passer used mobile phone to snap photo.,The passer branded the act disgusting.,Tesco said Vegetables Undergo ' extensive assessment ' before hitting shelves .,BLANK,BLANK,BLANK,BLANK,BLANK,BLANK,BLANK,n,n,n,n,n,n,n,p,p,p,p,p,n,n,n,p
cnndm8001,presumm_out_abs,"['560', '561', '562', '563', '564', '565', '566', '567', '568', '569', '570', '571', '572', '573', '574', '575']","Winchester Council said its annual clean - up of roads around the city had been hit by New Health and Safety Executive rules designed to protect litter - pickers from traffic . HSE denied tightening rules - and said councils were ` over-interpreting ' legislation . Former Poet Laureate Sir Andrew Motion said : ` Every Day , people tell us that they are disgusted , angry and ashamed of the state of England's Roads ' .",Winchester Council is in Hampshire,Winchester Council claimed annual clean - up,Winchester Council was hit by new rules.,Health and Safety Executive denied tightening rules.,Health and Safety Executive said that counciles were over-interpreting legislation.,Sir Andrew Motion is a poet laureate.,Sir Andrew Motion accused Town Hall bosses.,Sir Andrew Motion accused Highways Agency.,The accusation was of ruining the countryside.,The accusation was of failing to remove rubbish.,BLANK,BLANK,BLANK,BLANK,BLANK,BLANK,p,n,n,n,n,n,n,n,p,p,p,p,p,n,n,n
cnndm6731,presumm_out_abs,"['1520', '1521', '1522', '1523', '1524', '1525', '1526', '1527', '1528', '1529', '1530', '1531', '1532', '1533', '1534', '1535']","Charles Terreni Jr was four times over the legal alcohol limit when he died , an autopsy has found . He was found at the Pi Kappa Alpha House in Columbia , South Carolina , around 10:30 am on March 18 , the morning after an alleged ` kegger ' at the House for the annual Irish holiday . On Wednesday , several stray cups and a keg were seen on the porch , as well as clover decorations .",Charles Terreni was 18.,Charles Terreni was found dead.,Charles Terreni was found at a frat house.,The frat house is in Columbia.,Charles Terreni was a USC freshman.,Charles Terreni was a member of the Pi Kappa Alpha House .,Coroner identified cause of death.,Toxicology tests showed the blood alcohol.,BLANK,The blood alcohol was .375 .,Neighbors said there was a large party.,A beer keg was still visible outside.,Cause of death identified was alcohol poisoning.,Charles Terreni was found on March 18.,BLANK,BLANK,n,n,p,n,p,n,n,n,n,p,p,n,n,n,p,n
cnndm6731,presumm_out_abs,"['1520', '1521', '1522', '1523', '1524', '1525', '1526', '1527', '1528', '1529', '1530', '1531', '1532', '1533', '1534', '1535']","Charles Terreni Jr was four times over the legal alcohol limit when he died , an autopsy has found . He was found at the Pi Kappa Alpha House in Columbia , South Carolina , around 10:30 am on March 18 , the morning after an alleged ` kegger ' at the House for the annual Irish holiday . On Wednesday , several stray cups and a keg were seen on the porch , as well as clover decorations .",Charles Terreni was 18.,Charles Terreni was found dead.,Charles Terreni was found at a frat house.,The frat house is in Columbia.,Charles Terreni was a USC freshman.,Charles Terreni was a member of the Pi Kappa Alpha House .,Coroner identified cause of death.,Toxicology tests showed the blood alcohol.,BLANK,The blood alcohol was .375 .,Neighbors said there was a large party.,A beer keg was still visible outside.,Cause of death identified was alcohol poisoning.,Charles Terreni was found on March 18.,BLANK,BLANK,n,n,p,n,p,n,n,n,n,p,p,n,n,n,p,n
cnndm7670,presumm_out_abs,"['1376', '1377', '1378', '1379', '1380', '1381', '1382', '1383', '1384', '1385', '1386', '1387', '1388', '1389', '1390', '1391']",Andrew Flintoff fears Kevin Pietersen is ` running out of Time ' to resurrect his England career . Pietersen scored 170 for Surrey in the parks as he bids to earn a recall to the England squad . Pietersen has not played for England since he was sacked 14 months ago .,Kevin Pietersen was sacked by England.,Kevin Pietersen was sacked 14 months ago.,Kevin Pietersen was sacked after Ashes defeat.,Kevin Pietersen is a Batsman.,Kevin Pietersen scored 170 for Surrey.,Kevin Pietersen played last week .,Kevin Pietersen made a return to county cricket.,Kevin Pietersen wants his return to be sensational.,Kevin Pietersen wants to make a return to the England side.,Kevin Pietersen wants to make a return this year .,Andrew Flintoff thinks time is running out for Kevin Pietersen to resurrect his career.,BLANK,BLANK,BLANK,BLANK,BLANK,n,n,n,n,n,n,n,p,p,n,n,p,n,n,n,p
cnndm8306,presumm_out_abs,"['896', '897', '898', '899', '900', '901', '902', '903', '904', '905', '906', '907', '908', '909', '910', '911']",One of the victims suffered critical head trauma as the stage fell half - way through a song during a sold - out showing of American Pie at Westfield High School . The students behind her plunged into the orchestra pit and she was unable to move . More than 12 people were injured and least one person was critically injured .,There was a performance at an Indiana public school.,The performance was of American Pie.,The performance ended in tragedy.,The performance was on Wednesday.,A riser buckled at the performance.,The riser buckled as many danced on-stage.,More than a dozen people were injured.,The school is Westfield High.,One student was taken to a hospital in critical condition.,Students said there had been no issues previously.,Students said they previously practiced the song on the stage with the same number of people .,BLANK,BLANK,BLANK,BLANK,BLANK,n,n,n,n,n,n,n,n,p,p,n,n,n,p,p,p
cnndm8306,presumm_out_abs,"['896', '897', '898', '899', '900', '901', '902', '903', '904', '905', '906', '907', '908', '909', '910', '911']",One of the victims suffered critical head trauma as the stage fell half - way through a song during a sold - out showing of American Pie at Westfield High School . The students behind her plunged into the orchestra pit and she was unable to move . More than 12 people were injured and least one person was critically injured .,There was a performance at an Indiana public school.,The performance was of American Pie.,The performance ended in tragedy.,The performance was on Wednesday.,A riser buckled at the performance.,The riser buckled as many danced on-stage.,More than a dozen people were injured.,The school is Westfield High.,One student was taken to a hospital in critical condition.,Students said there had been no issues previously.,Students said they previously practiced the song on the stage with the same number of people .,BLANK,BLANK,BLANK,BLANK,BLANK,n,n,n,n,n,n,n,n,p,p,n,n,n,p,p,n
cnndm5635,presumm_out_abs,"['384', '385', '386', '387', '388', '389', '390', '391', '392', '393', '394', '395', '396', '397', '398', '399']","Gatso had enforced 30mph speed limit for motorists in Handsworth , Birmingham . But it has not been working for two years after every single fixed device was switched off in the West Midlands .",A Speed Camera was discovered pointing at a house.,The house was in Handsworth.,Handsworth was in Birmingham.,Fixed cameras were switched off across the West Midlands.,Fixed cameras were switched off across West Midlands in Spring of 2013.,She is not going to be part of a new trial.,The trial is about digital technology.,Obsolete camera may be taken down.,Engineers examine the device.,BLANK,BLANK,BLANK,BLANK,BLANK,BLANK,BLANK,n,n,n,n,n,n,n,n,n,p,p,n,n,n,n,n
cnndm10595,presumm_out_abs,"['976', '977', '978', '979', '980', '981', '982', '983', '984', '985', '986', '987', '988', '989', '990', '991']",Arsenal vice-captain per Mertesacker says Jurgen Klopp would be a top manager in the Premier League if he opts to continue his career in England . Mertesacker believes Klopp's passion would fit and to see him in England would be very interesting .,Jurgen Klopp will leave Borussia Dortmund.,Jurgen Klopp will leave at the end of the season.,Borussia Dortmund is a German team.,Jurgen Klopp enjoyed success with the club.,Jurgen Klopp had seven - year stint at the club.,Jurgen Klopp is linked with Manchester City.,Jurgen Klopp is linked with Manchester United.,Jurgen Klopp is linked with Arsenal.,Per Mertesacker made a statement about Jurgen Klopp.,Per Mertesacker would like to see Klopp in the Premier League.,Jurgen Klopp is the boss of a German club.,BLANK,BLANK,BLANK,BLANK,BLANK,p,n,n,n,n,n,n,n,n,n,n,n,n,n,n,p
cnndm10595,presumm_out_abs,"['976', '977', '978', '979', '980', '981', '982', '983', '984', '985', '986', '987', '988', '989', '990', '991']",Arsenal vice-captain per Mertesacker says Jurgen Klopp would be a top manager in the Premier League if he opts to continue his career in England . Mertesacker believes Klopp's passion would fit and to see him in England would be very interesting .,Jurgen Klopp will leave Borussia Dortmund.,Jurgen Klopp will leave at the end of the season.,Borussia Dortmund is a German team.,Jurgen Klopp enjoyed success with the club.,Jurgen Klopp had seven - year stint at the club.,Jurgen Klopp is linked with Manchester City.,Jurgen Klopp is linked with Manchester United.,Jurgen Klopp is linked with Arsenal.,Per Mertesacker made a statement about Jurgen Klopp.,Per Mertesacker would like to see Klopp in the Premier League.,Jurgen Klopp is the boss of a German club.,BLANK,BLANK,BLANK,BLANK,BLANK,p,n,n,n,n,n,n,n,n,n,n,n,n,n,n,p
cnndm19,presumm_out_abs,"['1456', '1457', '1458', '1459', '1460', '1461', '1462', '1463', '1464', '1465', '1466', '1467', '1468', '1469', '1470', '1471']","In 2009 , a Bay Area Rapid Transit officer fired his gun instead of his Taser , killing Eric Harris . Law enforcement experts say the gun should be holstered on the officer's dominant side of the body . If an officer is left - handed , the Taser should be placed on the left side .",An attorney says Robert Bates made an assumption.,An attorney says Robert Bates assumed the gun is a taser because Bates saw a laser sight on the gun .,Harris family lawyers say there are differences between the gun and Taser.,An officer in California made a statement in 2009.,An officer in California also said he mistakenly used his gun.,An officer in California also said he used his gun instead of a taser.,An attorney says Robert Bates thought the gun was a Taser.,BLANK,BLANK,BLANK,BLANK,BLANK,BLANK,BLANK,BLANK,BLANK,n,n,n,n,n,n,n,n,n,n,n,n,n,n,n,n
cnndm10231,presumm_out_abs,"['544', '545', '546', '547', '548', '549', '550', '551', '552', '553', '554', '555', '556', '557', '558', '559']","The Red Wings ' Drew Miller says he's eager to hit the ice again just a day after receiving a cut that could have cost him his eyesight . The incident occurred shortly after a faceoff during the first period of Tuesday's game between the Red Wing and the Senators . While battling for the puck , Ottawa's Mark Stone lost his balance and lifted his skate backwards in an arc , catching Miller just under his visor .",Drew Miller plays for Detroit Red Wings.,Drew Miller was caught by a skate.,Drew Miller was caught in the first period.,Detroit Red Wings played against Ottawa Senators.,The cut required stitches to close.,The cut required 50-60 stitches to close.,The cut did not damage Miller's eye.,The Detroit Red Wings lost 2-1.,The Detroit Red wings remain in third place.,The Detroit Red Wings play in the Atlantic Division.,BLANK,BLANK,BLANK,BLANK,BLANK,BLANK,n,n,n,n,n,n,n,p,p,p,p,n,n,p,n,n
cnndm4637,presumm_out_abs,"['1552', '1553', '1554', '1555', '1556', '1557', '1558', '1559', '1560', '1561', '1562', '1563', '1564', '1565', '1566', '1567']","East of England Ambulance Service sent two ambulances to Epping Forest . Caller told crews ` someone ' had been run down , only for ` victim ' to turn out to be a squirrel . Another man said he had dropped his burger and it was ` bleeding ' . Another came from Basildon , Essex , who said ` I 've eaten too much takeaway food ' .",East of England Ambulance Service warned about hoax calls,The Ambulance Service warned that hoax calls can cost lives,Woman reported someone had been run over,Actual victim in the incident reported by the woman was a squirrel,A man dialled 999.,The man reported that he dropped a burger,The man reported that the dropped burger was bleeding,BLANK,BLANK,BLANK,BLANK,BLANK,BLANK,BLANK,BLANK,BLANK,n,n,n,n,n,n,n,n,n,p,p,n,p,p,n,n
