Input.eventId,Input.summaryId,Input.qIdList,Input.summary_text,Input.statement_1,Input.statement_2,Input.statement_3,Input.statement_4,Input.statement_5,Input.statement_6,Input.statement_7,Input.statement_8,Input.statement_9,Input.statement_10,Input.statement_11,Input.statement_12,Input.statement_13,Input.statement_14,Input.statement_15,Input.statement_16,Answer.S10Answer,Answer.S11Answer,Answer.S12Answer,Answer.S13Answer,Answer.S14Answer,Answer.S15Answer,Answer.S16Answer,Answer.S1Answer,Answer.S2Answer,Answer.S3Answer,Answer.S4Answer,Answer.S5Answer,Answer.S6Answer,Answer.S7Answer,Answer.S8Answer,Answer.S9Answer
cnndm10542,presumm_out_abs,"['928', '929', '930', '931', '932', '933', '934', '935', '936', '937', '938', '939', '940', '941', '942', '943']",Dundee United striker Nadir ciftci scored a goal by blowing a kiss at opposition goalkeeper Scott Bain . The 23 - year - old celebrated by trying to Rile Bain but his actions came back to haunt him . It was Dundee's first win in a derby for more than 10 years .,Nadir Ciftci celebrated.,Nadir Ciftci blew a kiss.,The kiss was directed to rival goalkeeper.,The rival goalkeeper was Scott Bain.,Ciftci was left blushing.,Rivals earned an impressive victory .,The win gave hosts / Dundee their first Derby win in more than a decade .,The win was a Dundee win.,Hosts were Dundee.,Greg Stewart scored goal/goals.,Jake mcpake scored goal/goals.,Paul Heffernen scored goal/goals.,The goals secured a win.,BLANK,BLANK,BLANK,n,n,n,n,n,n,n,p,p,p,p,n,n,p,p,n
cnndm10542,presumm_out_abs,"['928', '929', '930', '931', '932', '933', '934', '935', '936', '937', '938', '939', '940', '941', '942', '943']",Dundee United striker Nadir ciftci scored a goal by blowing a kiss at opposition goalkeeper Scott Bain . The 23 - year - old celebrated by trying to Rile Bain but his actions came back to haunt him . It was Dundee's first win in a derby for more than 10 years .,Nadir Ciftci celebrated.,Nadir Ciftci blew a kiss.,The kiss was directed to rival goalkeeper.,The rival goalkeeper was Scott Bain.,Ciftci was left blushing.,Rivals earned an impressive victory .,The win gave hosts / Dundee their first Derby win in more than a decade .,The win was a Dundee win.,Hosts were Dundee.,Greg Stewart scored goal/goals.,Jake mcpake scored goal/goals.,Paul Heffernen scored goal/goals.,The goals secured a win.,BLANK,BLANK,BLANK,n,n,n,n,n,n,n,p,p,p,p,n,n,p,p,n
cnndm3152,presumm_out_abs,"['1440', '1441', '1442', '1443', '1444', '1445', '1446', '1447', '1448', '1449', '1450', '1451', '1452', '1453', '1454', '1455']","The 21 - year - old singer argued with security after being stopped at the artists ' entrance where Drake was performing at the event in Indio , California . A video obtained by TMZ appears to shows Bieber being put in a chokehold and escorted from the area . Bieber's team tangled with security and the singer was then ordered to leave the festival . Sources close to Bieber told TMZ that he voluntarily left and was considering taking legal action against the security guards .",Bieber is the singer.,Singer/Bieber arrived at the artists' entrance.,Singer/Bieber tried to gain entry to Drake's gig .,Security said area was at full capacity.,Security denied admission.,A row erupted.,A staffer tried to get singer/Bieber into the gig .,That staffer was a Coachella staffer .,Security intervened.,Security put singer/Bieber in chokehold.,Security removed singer/Bieber from the area .,Admission was denied to singer/Bieber.,The security was festival security.,BLANK,BLANK,BLANK,p,p,p,p,n,n,n,p,p,p,n,p,p,n,n,p
cnndm3152,presumm_out_abs,"['1440', '1441', '1442', '1443', '1444', '1445', '1446', '1447', '1448', '1449', '1450', '1451', '1452', '1453', '1454', '1455']","The 21 - year - old singer argued with security after being stopped at the artists ' entrance where Drake was performing at the event in Indio , California . A video obtained by TMZ appears to shows Bieber being put in a chokehold and escorted from the area . Bieber's team tangled with security and the singer was then ordered to leave the festival . Sources close to Bieber told TMZ that he voluntarily left and was considering taking legal action against the security guards .",Bieber is the singer.,Singer/Bieber arrived at the artists' entrance.,Singer/Bieber tried to gain entry to Drake's gig .,Security said area was at full capacity.,Security denied admission.,A row erupted.,A staffer tried to get singer/Bieber into the gig .,That staffer was a Coachella staffer .,Security intervened.,Security put singer/Bieber in chokehold.,Security removed singer/Bieber from the area .,Admission was denied to singer/Bieber.,The security was festival security.,BLANK,BLANK,BLANK,p,p,p,n,n,n,n,p,p,p,n,p,n,n,n,p
cnndm6564,presumm_out_abs,"['1072', '1073', '1074', '1075', '1076', '1077', '1078', '1079', '1080', '1081', '1082', '1083', '1084', '1085', '1086', '1087']","Maren Sanchez , 16 , was stabbed to death at Jonathan Law High School in Milford , Connecticut on April 25 , 2014 . A classmate , Christopher Plaskon , has been charged with murder as an adult . Sanchez's mother , Donna Cimarelli , said : ` If you knew Maren , she would have embraced an event like this ' .",Maren Sanchez was 16 year old.,Maren Sanchez stabbed to death.,Maren Sanchez was stabbed a year ago.,Maren Sanchez was stabbed on the day of Prom.,The life of Maren Sanchez was celebrated on Saturday.,The life of Maren Sanchez was celebrated by hundreds of people.,Someone doesn't thinks there's anything sad about the celebration.,Christopher Plaskon was a classmate of Maren Sanchez.,Christopher Plaskon has been charged with Sanchez's murder.,BLANK,BLANK,BLANK,BLANK,BLANK,BLANK,BLANK,n,n,n,n,n,n,n,p,p,n,n,n,n,n,p,p
cnndm6564,presumm_out_abs,"['1072', '1073', '1074', '1075', '1076', '1077', '1078', '1079', '1080', '1081', '1082', '1083', '1084', '1085', '1086', '1087']","Maren Sanchez , 16 , was stabbed to death at Jonathan Law High School in Milford , Connecticut on April 25 , 2014 . A classmate , Christopher Plaskon , has been charged with murder as an adult . Sanchez's mother , Donna Cimarelli , said : ` If you knew Maren , she would have embraced an event like this ' .",Maren Sanchez was 16 year old.,Maren Sanchez stabbed to death.,Maren Sanchez was stabbed a year ago.,Maren Sanchez was stabbed on the day of Prom.,The life of Maren Sanchez was celebrated on Saturday.,The life of Maren Sanchez was celebrated by hundreds of people.,Someone doesn't thinks there's anything sad about the celebration.,Christopher Plaskon was a classmate of Maren Sanchez.,Christopher Plaskon has been charged with Sanchez's murder.,BLANK,BLANK,BLANK,BLANK,BLANK,BLANK,BLANK,n,n,n,n,n,n,n,p,p,n,n,n,n,n,p,p
cnndm2292,presumm_out_abs,"['448', '449', '450', '451', '452', '453', '454', '455', '456', '457', '458', '459', '460', '461', '462', '463']","Tottenham will subsidise Emmanuel Adebayor's # 100,000 - per - week wages . The Togolese striker is out of favour under Mauricio Pochettino at White Hart Lane . The 31 - year - old has made just nine league starts this season . Click here for all the latest Tottenham News .",Emmanuel Adebayor has contract with Tottenham.,Emmanuel Adebayor's contract runs out in 2016.,Emmanuel Adebayor is a striker.,Emmanuel Adebayor / the striker wants more than his current salary.,Emmanuel Adebayor / the stirker earns 5.2 million.,Emmanuel Adebayor / the striker wants more than his current salary before accepting a move out of White Hart Lane.,Emmanuel Adebayor / the striker is from Togolese.,Emmanuel Adebayor / the striker has made nine league starts.,Emmanuel Adebayor / the striker has made nine league starts this season.,BLANK,BLANK,BLANK,BLANK,BLANK,BLANK,BLANK,n,n,n,n,n,n,n,p,n,p,n,n,p,p,p,p
cnndm2292,presumm_out_abs,"['448', '449', '450', '451', '452', '453', '454', '455', '456', '457', '458', '459', '460', '461', '462', '463']","Tottenham will subsidise Emmanuel Adebayor's # 100,000 - per - week wages . The Togolese striker is out of favour under Mauricio Pochettino at White Hart Lane . The 31 - year - old has made just nine league starts this season . Click here for all the latest Tottenham News .",Emmanuel Adebayor has contract with Tottenham.,Emmanuel Adebayor's contract runs out in 2016.,Emmanuel Adebayor is a striker.,Emmanuel Adebayor / the striker wants more than his current salary.,Emmanuel Adebayor / the stirker earns 5.2 million.,Emmanuel Adebayor / the striker wants more than his current salary before accepting a move out of White Hart Lane.,Emmanuel Adebayor / the striker is from Togolese.,Emmanuel Adebayor / the striker has made nine league starts.,Emmanuel Adebayor / the striker has made nine league starts this season.,BLANK,BLANK,BLANK,BLANK,BLANK,BLANK,BLANK,n,n,n,n,n,n,n,p,n,p,n,n,n,n,p,p
cnndm10563,presumm_out_abs,"['1504', '1505', '1506', '1507', '1508', '1509', '1510', '1511', '1512', '1513', '1514', '1515', '1516', '1517', '1518', '1519']","Olly Taylor , 27 , is offering his version of the Easter Feast at his Black Milk Cafe in Manchester's Northern Quarter . The breakfast includes two types of cereal served in half an easter egg , with brownies , marshmallows and mini eggs , topped off with three different types of flavoured milk . Mr Taylor says he has carried his fine - dining and knowledge of being a wine sommelier into black milk .",There are two types of cereal in an Easter egg.,An Easter egg is with marshmallows.,An Easter egg is with Brownies.,An Easter egg is served.,Black Milk Cafe is in Manchester's Northern Quarter.,"'Easter is less about what is used to mean , ' owner/Olly Taylor said .",BLANK,An Easter egg is served at Black Milk Cafe.,Olly Taylor is cafe owner.,BLANK,BLANK,BLANK,BLANK,BLANK,BLANK,BLANK,n,n,n,n,n,n,n,p,p,p,p,p,n,n,p,n
cnndm2065,presumm_out_abs,"['1408', '1409', '1410', '1411', '1412', '1413', '1414', '1415', '1416', '1417', '1418', '1419', '1420', '1421', '1422', '1423']","Abby Bishop , 26 , took in her two - day - old niece Zala in August 2013 . She juggled training with sleepless nights and adjust to her new life . Now Zala is 20 months old and she follows Bishop as she travels the world playing for professional teams .",Abby Bishop took in her niece,Niece is named Zala,Niece / Zala was two days old when Abby Bishop took her in,Abby Bishop took in her niece in August 2013,Niece / Zala is now 20 months old,Niece / Zala follows Bishop as she travels the world,Abby Bishop travels the world,Abby Bishop travels for professional basketball teams,Abby Bishop said taking in her niece / Zala was a big decision,Abby Bishop said that she wouldn't change anything,Niece / Zala will go with Abby Bishop when she starts playing in the U.S. WNBA,Abby Bishop will play for the U.S. WNBA in May,BLANK,BLANK,BLANK,BLANK,n,n,n,n,n,n,n,p,p,p,p,p,p,p,n,n
cnndm6048,presumm_out_abs,"['704', '705', '706', '707', '708', '709', '710', '711', '712', '713', '714', '715', '716', '717', '718', '719']",David Axelrod masterminded two presidential election wins for Barack Obama . He was hired by the Labour leader Amid great fanfare last year . He has helped refine Ed Miliband's message about tackling the cost of living .,David Axelrod masterminded election victories .,David Axelrod was behind two election victories.,The past election victories were for presidential elections.,David Axelrod was hired by Labour leader Ed Miliband.,The hiring occurred last year.,The hiring occurred amid great fanfare.,David Axelrod revealed something at a book launch.,David Axelrod revealed he is not resident for tax purposes in UK .,David Axelrod is paid in dollars.,David Axelrod is paid through consultancy firm .,Labour confirms details of David Axelrod's payment.,The past election victories were for Obama.,BLANK,BLANK,BLANK,BLANK,n,n,p,n,n,n,n,p,p,n,p,p,p,n,n,n
cnndm6048,presumm_out_abs,"['704', '705', '706', '707', '708', '709', '710', '711', '712', '713', '714', '715', '716', '717', '718', '719']",David Axelrod masterminded two presidential election wins for Barack Obama . He was hired by the Labour leader Amid great fanfare last year . He has helped refine Ed Miliband's message about tackling the cost of living .,David Axelrod masterminded election victories .,David Axelrod was behind two election victories.,The past election victories were for presidential elections.,David Axelrod was hired by Labour leader Ed Miliband.,The hiring occurred last year.,The hiring occurred amid great fanfare.,David Axelrod revealed something at a book launch.,David Axelrod revealed he is not resident for tax purposes in UK .,David Axelrod is paid in dollars.,David Axelrod is paid through consultancy firm .,Labour confirms details of David Axelrod's payment.,The past election victories were for Obama.,BLANK,BLANK,BLANK,BLANK,n,n,p,n,n,n,n,p,p,p,p,p,p,n,n,n
cnndm11351,presumm_out_abs,"['1328', '1329', '1330', '1331', '1332', '1333', '1334', '1335', '1336', '1337', '1338', '1339', '1340', '1341', '1342', '1343']","Appleinsider has spotted nine job listings on Apple's official recruitment site in the past month that relate to batteries . These include an IOS Battery Life Software Engineer , a Software Power Systems Engineer , battery pack engineering manager and a Cell Engineer . Apple defines the Apple Watch Battery on its watch product page . It says its All - day battery life is based on 18 hours of use .",Appleinsider spotted nine listings,Appleinsider spotted listings last month,Appleinsider spotted listings related to batteries,The listings include one for an IOS Battery Life Software Engineer,The listings include one for an IOS Software Power Systems Engineer,Appled improved battery life,The battery life of iphone 6 was improved,The battery life of iphone 6 plus was improved,Apple has been criticized for phones,Apple has been criticized for tablets,The criticism includes that phones don't last a day,The criticism includes that tablets don't last a day,BLANK,BLANK,BLANK,BLANK,n,n,n,n,n,n,n,p,p,p,p,p,n,n,n,n
cnndm7910,presumm_out_abs,"['880', '881', '882', '883', '884', '885', '886', '887', '888', '889', '890', '891', '892', '893', '894', '895']","Footage captured at Spring Garden Station in Philadelphia on Tuesday shows the group of youngsters viciously attacking the victims just seconds before the train pulls into the station . They then pull them to the ground , punch them and repeatedly stamp on their heads . The brawl , involving students from Benjamin Franklin High School , even spilled onto the tracks . Witnesses tried to intervene , but couldn't break up the group as the assailants continued on hitting the helpless youngsters .",A fight (could also be called brawl or confrontation) occurred.,The fight happened at Spring Gardens Station.,The fight was captured on CCTV.,Fight involved students.,Students involved were from Benjamin Franklin High School.,Benjamin Franklin High School is nearby.,At one point an attacker fell.,An attacker fell onto the tracks.,The fallen attacker managed to get back up.,"After the confrontation, the victims and attackers walked onto the same train .",Victims walked onto a train after confrontation.,Attackers walked onto a train after confrontation.,The fight happened in Philadelphia.,BLANK,BLANK,BLANK,n,n,n,p,n,n,n,p,p,p,p,p,n,n,p,n
cnndm7910,presumm_out_abs,"['880', '881', '882', '883', '884', '885', '886', '887', '888', '889', '890', '891', '892', '893', '894', '895']","Footage captured at Spring Garden Station in Philadelphia on Tuesday shows the group of youngsters viciously attacking the victims just seconds before the train pulls into the station . They then pull them to the ground , punch them and repeatedly stamp on their heads . The brawl , involving students from Benjamin Franklin High School , even spilled onto the tracks . Witnesses tried to intervene , but couldn't break up the group as the assailants continued on hitting the helpless youngsters .",A fight (could also be called brawl or confrontation) occurred.,The fight happened at Spring Gardens Station.,The fight was captured on CCTV.,Fight involved students.,Students involved were from Benjamin Franklin High School.,Benjamin Franklin High School is nearby.,At one point an attacker fell.,An attacker fell onto the tracks.,The fallen attacker managed to get back up.,"After the confrontation, the victims and attackers walked onto the same train .",Victims walked onto a train after confrontation.,Attackers walked onto a train after confrontation.,The fight happened in Philadelphia.,BLANK,BLANK,BLANK,n,n,n,p,n,n,n,p,p,n,p,p,n,n,n,n
cnndm6094,presumm_out_abs,"['1360', '1361', '1362', '1363', '1364', '1365', '1366', '1367', '1368', '1369', '1370', '1371', '1372', '1373', '1374', '1375']",Steven Finn was overlooked for the West Indies Tour . The 26 - year - old has spent time working on his run - up since the World Cup . Finn says he's been watching footage of when he was on the top of his form . England's fast - bowling stocks are starting to worry selectors .,Steven Finn plays for England,Steven Finn was left out of the England squad,England tour West Indies,Steven Finn is a Middlesex Quick Bowler,Steven Finn has regained form,Steven Finn's form returned after 12 months,Steven Finn said he's back to bowling,Steven Finn said he's bowling like he was a carefree 21 year old,Steven Finn has 23 test caps for England,Steven Finn played for England last in 2013,BLANK,BLANK,BLANK,BLANK,BLANK,BLANK,n,n,n,n,n,n,n,p,n,n,n,n,n,n,n,n
cnndm6094,presumm_out_abs,"['1360', '1361', '1362', '1363', '1364', '1365', '1366', '1367', '1368', '1369', '1370', '1371', '1372', '1373', '1374', '1375']",Steven Finn was overlooked for the West Indies Tour . The 26 - year - old has spent time working on his run - up since the World Cup . Finn says he's been watching footage of when he was on the top of his form . England's fast - bowling stocks are starting to worry selectors .,Steven Finn plays for England,Steven Finn was left out of the England squad,England tour West Indies,Steven Finn is a Middlesex Quick Bowler,Steven Finn has regained form,Steven Finn's form returned after 12 months,Steven Finn said he's back to bowling,Steven Finn said he's bowling like he was a carefree 21 year old,Steven Finn has 23 test caps for England,Steven Finn played for England last in 2013,BLANK,BLANK,BLANK,BLANK,BLANK,BLANK,n,n,n,n,n,n,n,n,n,n,n,n,n,n,n,n
cnndm5912,presumm_out_abs,"['464', '465', '466', '467', '468', '469', '470', '471', '472', '473', '474', '475', '476', '477', '478', '479']",Police say they have no objections to the 4 pm kick - off for Sunday's Manchester Derby at Old Trafford . The kick - off was agreed by all parties and revealed that the decision is down to good behaviour from supporters of each side . The Last Time United and City met in a late kick - off for a weekend match was in the FA Cup semi-final at Wembley in 2011 inside the ground fans in and close to the away end will be limited to two drinks every time they visit the bar .,Manchester United take on Manchester City.,The match is going to take place on Sunday.,The match will begin at 4 pm.,The match will take place at Old Trafford Home.,Police have no objections to the kick-off being late in the afternoon.,34 fans were arrested at Wembley.,The fans were arrested in 2011.,The fans were arrested in FA Cup semi-final.,The fans were arrested in the last late afternoon weekend kick-off.,The fans were arrested in the last late afternoon weekend kick-off in the Manchester Derby.,BLANK,BLANK,BLANK,BLANK,BLANK,BLANK,n,n,n,n,n,n,n,p,p,p,p,p,n,n,n,n
cnndm5912,presumm_out_abs,"['464', '465', '466', '467', '468', '469', '470', '471', '472', '473', '474', '475', '476', '477', '478', '479']",Police say they have no objections to the 4 pm kick - off for Sunday's Manchester Derby at Old Trafford . The kick - off was agreed by all parties and revealed that the decision is down to good behaviour from supporters of each side . The Last Time United and City met in a late kick - off for a weekend match was in the FA Cup semi-final at Wembley in 2011 inside the ground fans in and close to the away end will be limited to two drinks every time they visit the bar .,Manchester United take on Manchester City.,The match is going to take place on Sunday.,The match will begin at 4 pm.,The match will take place at Old Trafford Home.,Police have no objections to the kick-off being late in the afternoon.,34 fans were arrested at Wembley.,The fans were arrested in 2011.,The fans were arrested in FA Cup semi-final.,The fans were arrested in the last late afternoon weekend kick-off.,The fans were arrested in the last late afternoon weekend kick-off in the Manchester Derby.,BLANK,BLANK,BLANK,BLANK,BLANK,BLANK,n,n,n,n,n,n,n,p,p,p,n,p,n,n,n,n
cnndm6714,presumm_out_abs,"['272', '273', '274', '275', '276', '277', '278', '279', '280', '281', '282', '283', '284', '285', '286', '287']",General Motors has unveiled the Chevrolet - FNR Car . It has ` Dragonfly ' swing doors that open upwards and ` Crystal Laser Headlights ' . The car was unveiled at the Shanghai General Motors Gala Night This Week . It was developed in Shanghai by GM's Pan Asia Technical Automotive Centre ( PATAC ) joint venture .,General Motors unveiled their concept car.,General Motors unveiled their car at an event in Shanghai.,Chevrolet - Fnr has Dragonfly Swing doors.,Chevrolet - Fnr has Crystal Laser headlights.,The car is self driving.,The car is electric.,The car's front chairs can swivel round.,The car can be started using just your eyes.,The car can be started using Iris recognition software.,BLANK,BLANK,BLANK,BLANK,BLANK,BLANK,BLANK,n,n,n,n,n,n,n,p,p,p,p,n,n,n,n,n
cnndm6714,presumm_out_abs,"['272', '273', '274', '275', '276', '277', '278', '279', '280', '281', '282', '283', '284', '285', '286', '287']",General Motors has unveiled the Chevrolet - FNR Car . It has ` Dragonfly ' swing doors that open upwards and ` Crystal Laser Headlights ' . The car was unveiled at the Shanghai General Motors Gala Night This Week . It was developed in Shanghai by GM's Pan Asia Technical Automotive Centre ( PATAC ) joint venture .,General Motors unveiled their concept car.,General Motors unveiled their car at an event in Shanghai.,Chevrolet - Fnr has Dragonfly Swing doors.,Chevrolet - Fnr has Crystal Laser headlights.,The car is self driving.,The car is electric.,The car's front chairs can swivel round.,The car can be started using just your eyes.,The car can be started using Iris recognition software.,BLANK,BLANK,BLANK,BLANK,BLANK,BLANK,BLANK,n,n,n,n,n,n,n,p,p,p,p,n,n,n,n,n
cnndm4303,presumm_out_abs,"['1248', '1249', '1250', '1251', '1252', '1253', '1254', '1255', '1256', '1257', '1258', '1259', '1260', '1261', '1262', '1263']",Former Everton chairman Sir Philip Carter has died aged 87 . Carter also served as President of the Football League and a vice-president of the FA . Current Toffees Chairman Bill Kenwright also paid tribute to the former chairman .,Sir Philip Carter died at his home.,Sir Philip Carter died on Thursday morning.,Sir Philip Carter died after a short illness.,Sir Philip Carter served Everton.,Sir Philip Carter served during three spells.,Sir Philip Carter joined the club in 1977.,Toffees chairman is Bill Kenwright.,Bill Kenwright pays tribute to Sir Philip Carter.,Bill Kenwright calls Sir Philip Carter a ' great man and Leader '.,BLANK,BLANK,BLANK,BLANK,BLANK,BLANK,BLANK,n,n,n,n,n,n,n,n,n,n,p,n,n,p,p,n
cnndm4303,presumm_out_abs,"['1248', '1249', '1250', '1251', '1252', '1253', '1254', '1255', '1256', '1257', '1258', '1259', '1260', '1261', '1262', '1263']",Former Everton chairman Sir Philip Carter has died aged 87 . Carter also served as President of the Football League and a vice-president of the FA . Current Toffees Chairman Bill Kenwright also paid tribute to the former chairman .,Sir Philip Carter died at his home.,Sir Philip Carter died on Thursday morning.,Sir Philip Carter died after a short illness.,Sir Philip Carter served Everton.,Sir Philip Carter served during three spells.,Sir Philip Carter joined the club in 1977.,Toffees chairman is Bill Kenwright.,Bill Kenwright pays tribute to Sir Philip Carter.,Bill Kenwright calls Sir Philip Carter a ' great man and Leader '.,BLANK,BLANK,BLANK,BLANK,BLANK,BLANK,BLANK,n,n,n,n,n,n,n,n,n,n,p,n,n,p,p,n
cnndm11343,presumm_out_abs,"['400', '401', '402', '403', '404', '405', '406', '407', '408', '409', '410', '411', '412', '413', '414', '415']",Porto have received # 440million from player sales in the last 11 years . The Portuguese champions have made a habit of selling on players for huge profits . 19 of the 29 players featured in the table have South American backgrounds .,Danilo agrred this week.,Danilo agreed to join Real Madrid.,Danilo agreed to join in the summer.,Danilo agreed to join for 23 million.,Total player sales is 440 million since 2004.,James Rodriguez sold by Porto.,Pepe sold by Porto.,Radamel Falcao sold by Porto.,Click here for all the latest Real Madrid News .,Players sold by Porto.,BLANK,BLANK,BLANK,BLANK,BLANK,BLANK,p,n,n,n,n,n,n,n,n,n,n,n,n,n,n,n
cnndm11343,presumm_out_abs,"['400', '401', '402', '403', '404', '405', '406', '407', '408', '409', '410', '411', '412', '413', '414', '415']",Porto have received # 440million from player sales in the last 11 years . The Portuguese champions have made a habit of selling on players for huge profits . 19 of the 29 players featured in the table have South American backgrounds .,Danilo agrred this week.,Danilo agreed to join Real Madrid.,Danilo agreed to join in the summer.,Danilo agreed to join for 23 million.,Total player sales is 440 million since 2004.,James Rodriguez sold by Porto.,Pepe sold by Porto.,Radamel Falcao sold by Porto.,Click here for all the latest Real Madrid News .,Players sold by Porto.,BLANK,BLANK,BLANK,BLANK,BLANK,BLANK,p,n,n,n,n,n,n,n,n,n,n,n,n,n,n,n
